subject,grade_or_band,code,statement
Math	1	1.MD.1	Order three objects by length; compare the lengths of two objects indirectly by using a third object.
Math	1	1.MD.2	Express the length of an object as a whole number of length units, by laying multiple copies of a shorter object (the length unit) end to end; understand that the length measurement of an object is the number of same-size length units that span it with no gaps or overlaps. Limit to contexts where the object being measured is spanned by a whole number of length units with no gaps or overlaps.
Math	1	1.MD.3	Tell and write time in hours and half-hours using analog and digital clocks.
Math	1	1.MD.4	Organize, represent, and interpret data with up to three categories; ask and answer questions about the total number of data points, how many in each category, and how many more or less are in one category than in another.
Math	1	1.NBT.1	Count to 120 (recognizing growth and repeating patterns), starting at any number less than 120. In this range, read and write numerals and represent a number of objects with a written numeral.
Math	1	1.NBT.2a	10 can be thought of as a grouping of ten ones—called a “ten.”
Math	1	1.NBT.2b	The numbers from 11 to 19 are composed of a ten and one, two, three, four, five, six, seven, eight, or nine ones.
Math	1	1.NBT.2c	The numbers 10, 20, 30, 40, 50, 60, 70, 80, 90 refer to one, two, three, four, five, six, seven, eight, or nine tens (and 0 ones).
Math	1	1.NBT.3	Compare two two-digit numbers based on meanings of the tens and ones digits, recording the results of comparisons with the relational symbols >, <, =, and ≠.
Math	1	1.NBT.4	Add within 100 using concrete models or drawings and strategies based on place value, properties of operations, and/or the relationship between addition and subtraction; relate the strategy to a written method and explain the reasoning used including
Math	1	1.NBT.5	Given a two-digit number, mentally find 10 more or 10 less than the number, without having to count; explain the reasoning used.
Math	1	1.NBT.6	Subtract multiples of 10 in the range 10 to 90 from multiples of 10 in the range 10 to 90 (positive or zero differences), using concrete models or drawings and strategies based on place value, properties of operations, and/or the relationship between addition and subtraction; relate the strategy to a written method and explain the reasoning used.
Math	1	1.OA.1	Use addition and subtraction within 20 to solve word problems involving situations of adding to, taking from, putting together, taking apart, and comparing, with unknowns in all positions, (e.g. by using objects, drawings, and situation equations and/or solution equations with a symbol for the unknown number to represent the problem.)
Math	1	1.OA.2	Solve word problems that call for addition of three whole numbers whose sum is less than or equal to 20, (e.g. by using objects, drawings, and equations with a symbol for the unknown number to represent the problem.)
Math	1	1.OA.3	Apply (not necessary to name) properties of operations as strategies to add and subtract. Examples: is known, then is also known. (Commutative property of addition.) To add , the second two numbers can be added to make a ten, so . (Associative property of addition.) To add 0 to any number, the answer is that number (Additive identity property of 0). Students need not use formal terms for these properties.
Math	1	1.OA.4	Understand subtraction as an unknown-addend problem. For example, subtract by finding the number that makes 10 when added to 8.
Math	1	1.OA.5	Relate counting to addition and subtraction (e.g. by counting on 2 to add 2, counting back 1 to subtract 1).
Math	1	1.OA.6	).
Math	1	1.OA.8	Using related equations, Determine the unknown whole number in an addition or subtraction equation. For example, determine the unknown number that makes the equation true in each of the equations
Math	2	2.MD.1	Measure the length of an object by selecting and using appropriate tools such as rulers, yardsticks, meter sticks, and measuring tapes.
Math	2	2.MD.10	Draw a picture graph and a bar graph (with single-unit scale) to represent a data set with up to four categories. Solve simple put-together, take-apart, and compare problems using information presented in a bar graph (See Table 1).
Math	2	2.MD.2	Measure the length of an object twice, using length units of different lengths for the two measurements; describe how the two measurements relate to the size of the unit chosen.
Math	2	2.MD.3	Estimate lengths using whole units of inches, feet, centimeters, and meters.
Math	2	2.MD.4	Measure to determine how much longer one object is than another, expressing the length difference in terms of a standard length unit (inches, feet, centimeters, and meters).
Math	2	2.MD.5	Use addition and subtraction within 100 to solve one- and two-step word problems involving lengths that are given in the same units, e.g. by using drawings (such as drawings of rulers) and equations with a symbol for the unknown number to represent the problem.
Math	2	2.MD.6	Represent whole numbers as lengths from 0 on a number line diagram with equally spaced points corresponding to the numbers 0, 1, 2, …, and represent whole-number sums and differences within 100 on a number line diagram.
Math	2	2.MD.7	Tell and write time from analog and digital clocks to the nearest five minutes.
Math	2	2.MD.8	Solve word problems involving dollar bills, quarters, dimes, nickels, and pennies, using $ and ¢ symbols appropriately (Do not use decimal point, if showing 25 cents, use the word cents or ¢). For example: If you have 2 dimes and 3 pennies, how many cents do you have?
Math	2	2.MD.9	Generate measurement data by measuring lengths of several objects to the nearest whole unit, or by making repeated measurements of the same object using different units. Show the measurements by making a line plot, where the horizontal scale is marked off in whole-number units.
Math	2	2.NBT.1a	100 can be thought of as a bundle of ten tens—called a “hundred.”
Math	2	2.NBT.1b	The numbers 100, 200, 300, 400, 500, 600, 700, 800, 900 refer to one, two, three, four, five, six, seven, eight, or nine hundreds
Math	2	2.NBT.2	Count within 1000; skip-count by 2s, 5s, 10s, and 100s; explain and generalize the patterns.
Math	2	2.NBT.3	Read and write numbers within 1000 using base-ten numerals, number names, expanded form, and unit form unit form.
Math	2	2.NBT.4	Compare two three-digit numbers based on meanings of the hundreds, tens, and ones digits, using >, <, =, and ≠ relational symbols to record the results of comparisons.
Math	2	2.NBT.5	Fluently (efficiently, accurately, and flexibly) add and subtract within 100 using strategies based on place value, properties of operations, and/or the relationship between addition and subtraction (e.g. composing/decomposing by like base-10 units, using friendly or benchmark numbers, using related equations, compensation, number line, etc.).
Math	2	2.NBT.6	Add up to four two-digit numbers using strategies based on place value and properties of operations.
Math	2	2.NBT.7	Add and subtract within 1000, using concrete models or drawings and strategies based on place value, properties of operations, and/or the relationship between addition and subtraction; relate the strategy to a written method. Understand that in adding or subtracting three-digit numbers, like base-ten units such as hundreds and hundreds, tens and tens, ones and ones are used; and sometimes it is necessary to compose or decompose tens or hundreds.
Math	2	2.NBT.8	Mentally add 10 or 100 to a given number 100 – 900, and mentally subtract 10 or 100 from a given number 100 – 900.
Math	2	2.NBT.9	Explain why addition and subtraction strategies work using place value and the properties of operations. The explanations given may be supported by drawings or objects.
Math	2	2.OA.1	Use addition and subtraction within 100 to solve one- and two-step word problems involving situations of adding to, taking from, putting together, taking apart, and comparing, with unknowns in all positions, (e.g. by using drawings and situation equations and/or solution equations with a symbol for the unknown number to represent the problem.) Refer to shaded section of Table 1 for specific situation types.
Math	2	2.OA.2	Fluently (efficiently, accurately, and flexibly) add and subtract within 20 using mental strategies (counting on, making a ten, decomposing a number, creating an equivalent but easier and known sum, and using the relationship between addition and subtraction) Work with equal groups of objects to gain foundations for multiplication.
Math	2	2.OA.3	Determine whether a group of objects (up to 20) has an odd or even number of members, (e.g. by pairing objects or counting them by 2s); write an equation to express an even number as a sum of two equal addends.
Math	2	2.OA.4	Use addition to find the total number of objects arranged in rectangular arrays with up to 5 rows and up to 5 columns; write an equation to express the total as a sum of equal addends.
Math	3	3.MD.1	Tell and write time to the nearest minute using a.m. and p.m. and measure time intervals in minutes. Solve word problems involving addition and subtraction of time intervals in minutes, (e.g. by representing the problem on a number line diagram.) (See Table 1)
Math	3	3.MD.2	Add, subtract, multiply, or divide to solve one-step word problems involving masses or volumes that are given in the same units, (e.g. by using drawings (such as a beaker with a measurement scale) to represent the problem.) (Excludes multiplicative comparison problems) (See Table 1 and Table 2).
Math	3	3.MD.3	Draw a scaled picture graph and a scaled bar graph to represent a data set with several categories. Solve one- and two-step “how many more” and “how many less” problems using information presented in scaled bar graphs. (See Table 1). For example, draw a bar graph in which each square in the bar graph might represent 5 pets.
Math	3	3.MD.4	Generate measurement data by measuring lengths using rulers marked with halves and fourths of an inch. Show the data by making a line plot, where the horizontal scale is marked off in appropriate units—whole numbers, halves, or quarters.
Math	3	3.MD.5a	A square with side length 1 unit, called “a unit square,” is said to have “one square unit” of area, and can be used to measure area (does not require standard square units).
Math	3	3.MD.5b	A plane figure which can be covered without gaps or overlaps by n unit squares is said to have an area of n square units (does not require standard square units).
Math	3	3.MD.6	Measure areas by counting unit squares (square cm, square m, square in, square ft, and non-standard square units).
Math	3	3.MD.7a	Find the area of a rectangle with whole-number side lengths by tiling it, and show that the area is the same as would be found by multiplying the side lengths.
Math	3	3.MD.7b	Multiply side lengths to find areas of rectangles with whole-number side lengths in the context of solving real world and mathematical problems, and represent whole-number products as rectangular areas in mathematical reasoning.
Math	3	3.MD.7c	Use tiling to show in a concrete case that the area of a rectangle with whole-number side lengths a and is the sum of and . Use area models to represent the distributive property in mathematical reasoning (Supports 3.OA.5).
Math	3	3.MD.7d	Recognize area as additive. Find areas of rectilinear figures by decomposing them into non-overlapping rectangles and adding the areas of the non-overlapping parts, applying this technique to solve real world problems.
Math	3	3.MD.8	Solve real world and mathematical problems involving perimeters of polygons, including finding the perimeter given the side lengths, finding an unknown side length, and exhibiting rectangles with the same perimeter and different areas or with the same area and different perimeters.
Math	3	3.NBT.1	Use place value understanding to round whole numbers to the nearest 10 or 100.
Math	3	3.NBT.2	Fluently (efficiently, accurately, & flexibly) add and subtract within 1000 using strategies (e.g. composing/decomposing by like base-10 units, using friendly or benchmark numbers, using related equations, compensation, number line, etc.) and algorithms (including, but not limited to: traditional, partial-sums, etc.) based on place value, properties of operations, and/or the relationship between addition and subtraction.
Math	3	3.NBT.3	Multiply one-digit whole numbers by multiples of 10 in the range 10 to 90 (e.g. , ) using strategies based on place value and properties of operations.
Math	3	3.NF.1	Understand a fraction as the quantity formed by 1 part when a whole is partitioned into b equal parts; understand a fraction as the quantity formed by a parts of size .
Math	3	3.NF.2a	Represent a fraction on a number line diagram by defining the interval from 0 to 1 as the whole and partitioning it into b equal parts. Recognize that each part has size and that the endpoint of the part based at 0 locates the number on the number line.
Math	3	3.NF.2b	Represent a fraction on a number line diagram by marking off a lengths from 0. Recognize that the resulting interval has size and that its endpoint locates the number on the number line (a is the countable units of that determines the place on the number line).
Math	3	3.NF.3a	Understand two fractions as equivalent (equal) if they are the same size, or the same point on a number line.
Math	3	3.NF.3b	Recognize and generate simple equivalent fractions, (e.g. .) Explain why the fractions are equivalent, e.g. by using a visual fraction model.
Math	3	3.NF.3c	Express whole numbers as fractions, and recognize fractions that are equivalent to whole numbers. Examples: Express 3 in the form; recognize that; locate and 1 at the same point of a number line diagram.
Math	3	3.NF.3d	Compare two fractions with the same numerator or the same denominator by reasoning about their size. Recognize that comparisons are valid only when the two fractions refer to the same whole. Record the results of comparisons with the relational symbols >, <, =, or ≠, and justify the conclusions, (e.g. by using a visual fraction model.)
Math	3	3.OA.1	Interpret products of whole numbers, (e.g. interpret as the total number of objects in 5 groups of 7 objects each.)
Math	3	3.OA.2	Interpret whole-number quotients of whole numbers, (e.g. interpret as the number of objects in each share when 56 objects are partitioned equally into 8 shares, or as a number of shares when 56 objects are partitioned into equal shares of 8 objects each.)
Math	3	3.OA.3	Use multiplication and division within 100 to solve word problems in situations involving equal groups, arrays, and measurement quantities, (e.g. by using drawings and equations with a symbol for the unknown number to represent the problem.) Refer to shaded section of Table 2 for specific situation types.
Math	3	3.OA.4	Determine the unknown whole number in a multiplication or division equation by using related equations. For example, determine the unknown number that makes the equation true in each of the equations
Math	3	3.OA.5	is known, then is also known. (Commutative property of multiplication.) can be found by , then , or by , then . (Associative property of multiplication.) Knowing that and , one can find as . (Distributive property.) Students need not use formal terms for these properties.
Math	3	3.OA.6	Understand division as an unknown-factor problem. For example, find by finding the number that makes 32 when multiplied by 8.
Math	3	3.OA.7	Fluently (efficiently, accurately, and flexibly) multiply and divide with single digit multiplications and related divisions using strategies (e.g. relationship between multiplication and division, doubles, double and double again, half and then double, etc.) or properties of operations.
Math	3	3.OA.8	Solve two-step word problems using any of the four operations. Represent these problems using both situation equations and/or solution equations with a letter or symbol standing for the unknown quantity (refer to Table 1 and Table 2 and standard 3.OA.3). Assess the reasonableness of answers using mental computation and estimation strategies including rounding. This standard is limited to problems posed with whole numbers and having whole-number answers.
Math	3	3.OA.9	Identify arithmetic patterns (including patterns in the addition table or multiplication table), and explain them using properties of operations (See Table 5). For example, observe that 4 times a number is always even, and explain why 4 times a number can be decomposed into two equal addends.
Math	4	4.MD.1	Know relative sizes of measurement units within one system of units including km, m, cm; kg, g; lb, oz; l, ml; hr, min, sec. Within a single system of measurement, express measurements in a larger unit in terms of a smaller unit. Record measurement equivalents in a two-column table. For example, know that 1 ft is 12 times as long as 1 in. Express the length of a 4 ft snake as 48 in. Generate a conversion table for feet and inches listing the number pairs (1, 12), (2, 24), (3, 36), …
Math	4	4.MD.2	Use the four operations to solve word problems (See Table 1 and Table 2) involving distances, intervals of time, liquid volumes, masses of objects, and money, including problems involving simple fractions or decimals, and problems that require expressing measurements given in a larger unit in terms of a smaller unit. Represent measurement quantities using diagrams such as number line diagrams that feature a measurement scale.
Math	4	4.MD.3	Apply the area and perimeter formulas for rectangles in real world and mathematical problems explaining and justifying the appropriate unit of measure. For example, find the width of a rectangular room given the area of the flooring and the length, by viewing the area formula as a multiplication equation with an unknown factor.
Math	4	4.MD.4	Make a data display (line plot, bar graph, pictograph) to show a set of measurements in fractions of a unit . Solve problems involving addition and subtraction of fractions by using information presented in the data display. For example, from a line plot find and interpret the difference in length between the longest and shortest specimens in an insect collection.
Math	4	4.MD.5a	An angle is measured with reference to a circle with its center at the common endpoint of the rays, by considering the fraction of the circular arc between the points where the two rays intersect the circle. An angle that turns through of a circle is called a “one-degree angle,” and can be used to measure angles.
Math	4	4.MD.5b	An angle that turns through n one-degree angles is said to have an angle measure of n degrees.
Math	4	4.MD.6	Measure angles in whole-number degrees using a protractor. Draw angles of specified measure using a protractor and straight edge.
Math	4	4.MD.7	Recognize angle measure as additive. When an angle is decomposed into non-overlapping parts, the angle measure of the whole is the sum of the angle measures of the parts. Solve addition and subtraction problems to find unknown angles on a diagram in real world and mathematical problems, e.g. by using an equation with a symbol for the unknown angle measure.
Math	4	4.NBT.1	Recognize that in a multi-digit whole number, a digit in one place represents ten times what it represents in the place to its right. For example, recognize that by applying concepts of place value and division.
Math	4	4.NBT.2	Read and write multi-digit whole numbers using base-ten numerals, number names, expanded form, and unit form. Compare two multi-digit numbers based on meanings of the digits in each place, using >, <, =, and ≠ symbols to record the results of comparisons. (Note: Students should demonstrate understanding and application of place value decomposition. For example, 127 can be 1 hundred, 2 tens, 7 ones or 12 tens, 7 ones Refer to 2.NBT.1)
Math	4	4.NBT.3	Use place value understanding to round multi-digit whole numbers to any place.
Math	4	4.NBT.4	Fluently (efficiently, accurately, and flexibly) add and subtract multi-digit whole numbers using an efficient algorithm (including, but not limited to: traditional, partial-sums, etc.), based on place value understanding and the properties of operations.
Math	4	4.NBT.5	Multiply a whole number of up to four digits by a one-digit whole number, and multiply two two-digit numbers, using strategies based on place value and the properties of operations. Illustrate and explain the calculation by using equations, rectangular arrays, and/or area models.
Math	4	4.NBT.6	Find whole-number quotients and remainders with up to four-digit dividends and one-digit divisors, using strategies based on place value, the properties of operations, and/or the relationship between multiplication and division. Illustrate and explain the calculation by using equations, rectangular arrays, and/or area models.
Math	4	4.NF.1	Explain why a fraction is equivalent to a fraction by using visual fraction models, with attention to how the number and size of the parts differ even though the two fractions themselves are the same size. Use this principle to recognize and generate equivalent fractions.
Math	4	4.NF.2	Compare two fractions with different numerators and different denominators, (e.g. by creating common numerators or denominators, or by comparing to a benchmark fraction such as .) Recognize that comparisons are valid only when the two fractions refer to the same whole. Record the results of comparisons with relational symbols >, <, =, or ≠, and justify the conclusions, (e.g. by using visual fraction models.).
Math	4	4.NF.3a	Understand addition and subtraction of fractions as joining and separating parts referring to the same whole.
Math	4	4.NF.3b	Decompose a fraction into a sum of fractions with the same denominator in more than one way, recording each decomposition by an equation. Justify decompositions, e.g. by using a visual fraction model.
Math	4	4.NF.3c	Add and subtract mixed numbers with like denominators, e.g. by replacing each mixed number with an equivalent fraction (simplest form is not an expectation), and/or by using properties of operations and the relationship between addition and subtraction.
Math	4	4.NF.3d	Solve word problems involving addition and subtraction of fractions referring to the same whole and having like denominators, e.g. by using visual fraction models and equations to represent the problem.
Math	4	4.NF.4a	Understand a fraction as a multiple of . For example, use a visual fraction model to represent as 5 copies of , recording the conclusion by the equation .
Math	4	4.NF.4b	Understand a multiple of as a multiple of , and use this understanding to multiply a fraction by a whole number. For example, use a visual fraction model to express as , recognizing this product as . (In general, .).
Math	4	4.NF.4c	Solve word problems involving multiplication of a fraction by a whole number, (See Table 2) (e.g. by using visual fraction models and equations to represent the problem.) For example, if each person at a party will eat of a pound of roast beef, and there will be 5 people at the party, how many pounds of roast beef will be needed? Between what two whole numbers does your answer lie?
Math	4	4.NF.5	Express a fraction with denominator 10 as an equivalent fraction with denominator 100, and use this technique to add two fractions with respective denominators 10 and 100. For example, express as , and add.
Math	4	4.NF.6	Use decimal notation for fractions with denominators 10 or 100. For example, rewrite 0.62 as ; describe a length as 0.62 meters; locate 0.62 on a number line diagram.
Math	4	4.NF.7	Compare two decimals to hundredths by reasoning about their size. Recognize that comparisons are valid only when the two decimals refer to the same whole. Record the results of comparisons with the relational symbols >, < =, or ≠, and justify the conclusions, (e.g. by using a visual model.).
Math	4	4.OA.1	Interpret a multiplication equation as a comparison, (e.g. interpret as a statement that 35 is 5 times as many as 7 and 7 times as many as 5.) Represent verbal statements of multiplicative comparisons as multiplication equations.
Math	4	4.OA.2	Multiply or divide to solve word problems involving multiplicative comparison, (e.g. by using drawings and equations with a symbol for the unknown number to represent the problem, distinguishing multiplicative comparison from additive comparison.)
Math	4	4.OA.3	Solve multi-step word problem posed with whole numbers and having whole number answers using the four operations, including problems in which remainders must be interpreted. Represent these problems using situation equations and/or solution equations with a letter or symbol standing for the unknown quantity. Assess the reasonableness of answers using mental computation and estimation strategies including rounding.
Math	4	4.OA.4	Find all factor pairs for a whole number in the range 1 to 100. Recognize that a whole number is a multiple of each of its factors. Determine whether a given whole number in the range 1 to 100 is a multiple of a given one-digit number. Determine whether a given whole number in the range 1 to 100 is prime or composite.
Math	4	4.OA.5	Generate a number or shape pattern that follows a given rule. Identify apparent features of the pattern that were not explicit in the rule itself. For example, given the rule “Add 3” and the starting number 1, generate terms in the resulting sequence and observe that the terms appear to alternate between odd and even numbers. Explain informally why the numbers will continue to alternate in this way.
Math	5	5.MD.1	Convert among different-sized standard measurement units within a given measurement system (e.g. convert 5 cm to 0.05 m), and use these conversions in solving multi-step, real world problems.
