subject,grade_or_band,code,statement
Math	5	5.MD.2	Make a data display (line plot, bar graph, pictograph) to show a data set of measurements in fractions of a unit (). Use operations (add, subtract, multiply) on fractions for this grade to solve problems involving information presented in the data display. For example, given different measurements of liquid in identical beakers, find the amount of liquid each beaker would contain if the total amount in all the beakers were redistributed equally. After lunch everyone measured how much milk they had left in their containers. Make a line plot showing data to the nearest cup. Which value has the greatest amount? What is the total?
Math	5	5.MD.3a	A cube with side length 1 unit, called a “unit cube,” is said to have “one cubic unit” of volume, and can be used to measure volume.
Math	5	5.MD.3b	A solid figure which can be packed without gaps or overlaps using n unit cubes is said to have a volume of n cubic units.
Math	5	5.MD.4	Measure volumes by counting unit cubes such as cubic cm, cubic in, cubic ft. or non-standard cubic units.
Math	5	5.MD.5a	Find the volume of a right rectangular prism with whole-number side lengths by packing it with unit cubes, and show that the volume is the same as would be found by multiplying the edge lengths, equivalently by multiplying the height by the area of the base. Represent three-dimensional whole-number products as volumes, (e.g. to represent the associative property of multiplication.)
Math	5	5.MD.5b	Apply the formulas (B represents the area of the base) for rectangular prisms to find volumes of right rectangular prisms with whole-number edge lengths in the context of solving real world and mathematical problems.
Math	5	5.MD.5c	Recognize volume as additive. Find volumes of solid figures composed of two non-overlapping right rectangular prisms by adding the volumes of the non-overlapping parts, applying this technique to solve real world problems.
Math	5	5.NBT.1	Recognize that in a multi-digit number, a digit in one place represents 10 times as much as it represents in the place to its right and of what it represents in the place to its left.
Math	5	5.NBT.2	Explain patterns in the number of zeros of the product when multiplying a number by powers of 10, and explain patterns in the placement of the decimal point when a decimal is multiplied or divided by a power of 10. Use whole-number exponents to denote powers of 10.
Math	5	5.NBT.3a	.392 = 4 tens + 7 ones + 3 tenths + 9 hundredths + 2 thousandths).
Math	5	5.NBT.3b	Compare two decimals to thousandths based on meanings of the digits in each place, using >, <, =, and ≠relational symbols to record the results of comparisons.
Math	5	5.NBT.4	Use place value understanding to round decimals to any place (Note: In fifth grade, decimals include whole numbers and decimal fractions to the hundredths place.)
Math	5	5.NBT.5	Fluently (efficiently, accurately, and flexibly) multiply multi-digit whole numbers using an efficient algorithm (ex., traditional, partial products, etc.) based on place value understanding and the properties of operations.
Math	5	5.NBT.6	Find whole-number quotients of whole numbers with up to four-digit dividends and two-digit divisors, using strategies based on place value, the properties of operations, and/or the relationship between multiplication and division. Illustrate and explain the calculation by using equations, rectangular arrays, and/or area models.
Math	5	5.NBT.7	Add, subtract, multiply, and divide decimals to hundredths, using concrete models or drawings and strategies based on place value, properties of operations, and/or the relationship between addition and subtraction; relate the strategy to a written method and explain the reasoning used.
Math	5	5.NF.1	In general,
Math	5	5.NF.2	Solve word problems involving addition and subtraction of fractions referring to the same whole, including cases of unlike denominators, (e.g. by using visual fraction models or equations to represent the problem.) Use benchmark fractions and number sense of fractions to estimate mentally and assess the reasonableness of answers. (See Table 1 to view situation types). For example, recognize an incorrect result by observing that .
Math	5	5.NF.3	Interpret a fraction as division of the numerator by the denominator . Solve word problems involving division of whole numbers leading to answers in the form of fractions or mixed numbers, e.g. by using visual fraction models or equations to represent the problem. For example, interpret as the result of dividing 3 by 4, noting that multiplied by 4 equals 3, and that when 3 wholes are shared equally among 4 people each person has a share of size . If 9 people want to share a 50-pound sack of rice equally by weight, how many pounds of rice should each person get? Between what two whole numbers does your answer lie?
Math	5	5.NF.4a	and create a story context for this equation. Do the same with . (In general, ).
Math	5	5.NF.4b	Find the area of a rectangle with fractional side lengths by tiling it with unit squares of the appropriate unit fraction side lengths, and show that the area is the same as would be found by multiplying the side lengths. Multiply fractional side lengths to find areas of rectangles, and represent fraction products as rectangular areas.
Math	5	5.NF.5a	Comparing the size of a product to the size of one factor based on the size of the other factor, without performing the indicated multiplication (e.g. They see as half the size of 3.).
Math	5	5.NF.5b	Explain why multiplying a given number by a fraction greater than 1 results in a product greater than the given number (recognizing multiplication by whole numbers greater than 1 as a familiar case); explain why multiplying a given number by a fraction less than 1 results in a product smaller than the given number; and relating the principle of fraction equivalence to the effect of multiplying by 1. (e.g. Students may have the misconception that multiplication always produces a larger result. They need to have the conceptual understanding with examples like; will have a product that is less than 12.)
Math	5	5.NF.6	Solve real world problems involving multiplication of fractions and mixed numbers, (e.g. by using visual fraction models or equations to represent the problem) (See Table 2 to view situation types).
Math	5	5.NF.7a	Interpret division of a unit fraction by a non-zero whole number, and compute such quotients. For example, create a story context for , and use a visual fraction model to show the quotient. Use the relationship between multiplication and division to explain that because .
Math	5	5.NF.7b	Interpret division of a whole number by a unit fraction, and compute such quotients. For example, create a story context for , and use a visual fraction model to show the quotient. Use the relationship between multiplication and division to explain that because .
Math	5	5.NF.7c	Solve real world problems involving division of unit fractions by non-zero whole numbers and division of whole numbers by unit fractions, e.g. by using visual fraction models and equations to represent the problem. For example, how much chocolate will each person get if 3 people share lb of chocolate equally? How many cup servings are in 2 cups of raisins?
Math	5	5.OA.1	Use parentheses in numerical expressions and evaluate expressions with these symbols.
Math	5	5.OA.2	because parenthetical information must be solved first. Recognize that is three times as large as , without having to calculate the indicated sum or product.
Math	6	6.EE.1	Write and evaluate numerical expressions involving whole-number exponents.
Math	6	6.EE.2a	Write expressions that record operations with numbers and with letters standing for numbers. For example, express the calculation “Subtract y from 5” as .
Math	6	6.EE.2b	Identify parts of an expression using mathematical terms (sum, term, product, factor, quotient, coefficient); view one or more parts of an expression as a single entity. For example, describe the expression as a product of two factors; view as both a single entity and a sum of two terms.
Math	6	6.EE.2c	Evaluate expressions at specific values of their variables. Include expressions that arise from formulas used in real-world problems. Perform arithmetic operations, including those involving whole-number exponents, in the conventional order when there are no parentheses to specify a particular order (Order of Operations). For example, use the formulas to find the volume and surface area of a cube with sides of length .
Math	6	6.EE.3	to produce the equivalent expression 3y. (6.EE.3)
Math	6	6.EE.4	to produce the equivalent expression 3y. (6.EE.3)
Math	6	6.EE.5	Understand solving an equation or inequality as a process of answering a question: which values from a specified set, if any, make the equation or inequality true? Use substitution to determine whether a given number in a specified set makes an equation or inequality true.
Math	6	6.EE.6	Use variables to represent numbers and write expressions when solving a real-world or mathematical problem; understand that a variable can represent an unknown number, or, depending on the purpose at hand, any number in a specified set.
Math	6	6.EE.7	Write and solve one-step equations involving non-negative rational numbers using addition, subtraction, multiplication and division.
Math	6	6.EE.8	Write an inequality of the form to represent a constraint or condition in a real-world or mathematical problem. Recognize that inequalities of the form have infinitely many solutions; represent solutions of such inequalities on number line diagrams.
Math	6	6.EE.9	Write an equation to express one quantity, thought of as the dependent variable, in terms of the other quantity, thought of as the independent variable. For example, in a problem involving motion at constant speed, list and graph ordered pairs of distances and times, and write the equation to represent the relationship between distance and time.
Math	6	6.NS.1	Interpret and compute quotients of fractions, and solve word problems involving division of fractions by fractions, requiring multiple exposures connecting various concrete and abstract models.
Math	6	6.NS.2	Fluently (efficiently, accurately, and flexibly) divide multi-digit numbers using an efficient algorithm.
Math	6	6.NS.3	Fluently (efficiently, accurately, and flexibly) add, subtract, multiply, and divide multi-digit decimals using an efficient algorithm for each operation.
Math	6	6.NS.4	Find the greatest common factor of two whole numbers less than or equal to 100 and the least common multiple of two whole numbers less than or equal to 12. Use the distributive property to express a sum of two whole numbers 1–100 with a common factor as a multiple of a sum of two whole numbers with no common factor. For example, express .
Math	6	6.NS.5	Understand positive and negative numbers to describe quantities having opposite directions or values (e.g. temperature above/below zero, elevation above/below sea level, credits/debits, positive/negative electric charge)
Math	6	6.NS.6a	Recognize opposite signs of numbers as indicating locations on opposite sides of 0 on the number line; recognize that the opposite of the opposite of a number is the number itself, (e.g. ,) and that 0 is its own opposite. (6.NS.6a)
Math	6	6.NS.6b	Recognize opposite signs of numbers as indicating locations on opposite sides of 0 on the number line; recognize that the opposite of the opposite of a number is the number itself, (e.g. ,) and that 0 is its own opposite. (6.NS.6a)
Math	6	6.NS.6c	Recognize signs of numbers in ordered pairs indicate locations in quadrants of the coordinate plane; recognize that when two ordered pairs differ only by signs, the locations of the points are related by reflections across one or both axes.
Math	6	6.NS.6d	Find and position integers and other rational numbers on a horizontal or vertical number line diagram; find and position pairs of integers and other rational numbers on a coordinate plane.
Math	6	6.NS.7a	Interpret statements of inequality as statements about the relative position of two numbers on a number line diagram. For example, interpret as a statement that –3 is located to the right of –7 on a number line oriented from left to right.
Math	6	6.NS.7b	Write, interpret, and explain statements of order for rational numbers in real-world contexts. For example, write to express the fact that is warmer than .
Math	6	6.NS.7c	Explain the absolute value of a rational number as its distance from 0 on the number line; interpret absolute value as magnitude for a positive or negative quantity in a real-world situation. For example, for an account balance of –30 dollars, write to describe the size of the debt in dollars.
Math	6	6.NS.7d	Distinguish comparisons of absolute value from statements about order. For example, recognize that an account balance less than –30 dollars represents a debt greater than 30 dollars.
Math	6	6.NS.8	Solve real-world and mathematical problems by graphing points in all four quadrants of the coordinate plane. Include use of coordinates and absolute value to find distances between points with the same first coordinate or the same second coordinate.
Math	6	6.RP.1	Use ratio language to describe a relationship between two quantities. Distinguish between part-to-part and part-to-whole relationships. For example, “The ratio of wings to beaks in the bird house at the zoo was 2:1, because for every 2 wings there was 1 beak.” “For every vote candidate A received, candidate C received nearly three votes.”
Math	6	6.RP.2	Use unit rate language (“for each one”, “for every one” and “per”) and unit rate notation to demonstrate understanding the concept of a unit rate associated with a ratio , For example, “This recipe has a ratio of 3 cups of flour to 4 cups of sugar, so there is cup of flour for each cup of sugar.” “We paid $75 for 15 hamburgers, which is a rate of $5 per hamburger.” (Expectations for unit rates in this grade are limited to non-complex fractions.)
Math	6	6.RP.3a	Make tables of equivalent ratios relating quantities with whole-number measurements, find the missing values in the tables, and plot the pairs of values on the coordinate plane. Use tables to compare ratios. Solve unit rate problems including those involving unit pricing and constant speed. For example, if it took 7 hours to mow 4 lawns, then at that rate, how many lawns could be mowed in 35 hours? At what rate were lawns being mowed? (6.RP.3a)
Math	6	6.RP.3b	Make tables of equivalent ratios relating quantities with whole-number measurements, find the missing values in the tables, and plot the pairs of values on the coordinate plane. Use tables to compare ratios. Solve unit rate problems including those involving unit pricing and constant speed. For example, if it took 7 hours to mow 4 lawns, then at that rate, how many lawns could be mowed in 35 hours? At what rate were lawns being mowed? (6.RP.3a)
Math	6	6.RP.3c	Find a percent of a quantity as a rate per 100 (e.g. 30% of a quantity means times the quantity); solve problems involving finding the whole, given a part and the percent.
Math	6	6.RP.3d	Use ratio reasoning to convert measurement units; manipulate and transform units appropriately when multiplying or dividing quantities.
Math	6	6.SP.1	Recognize and generate a statistical question as one that anticipates variability in the data related to the question and accounts for it in the answers. For example, “How old am I?” is not a statistical question, but “How old are the students in my school?” is a statistical question because one anticipates variability in students’ ages.
Math	6	6.SP.2	Analyze a set of data collected to answer a statistical question with a distribution which can be described by its center (mean, median and/or mode), spread (range and/or interquartile range), and overall shape (cluster, peak, gap, symmetry, skew (data) and/or outlier).
Math	6	6.SP.3	Recognize that a measure of center (mean, median and/or mode) for a numerical data set summarizes all of its values with a single number, while a measure of variation (range and/or interquartile range) describes how its values vary with a single number.
Math	6	6.SP.4	Display numerical data on dot plots, histograms, stem-and-leaf plots, and box plots.
Math	6	6.SP.5a	Reporting the number of observations.
Math	6	6.SP.5b	Describing the nature of the attribute under investigation, including how it was measured and its units of measurement.
Math	6	6.SP.5c	Giving quantitative measures of center (mean, median and/or mode) and variability (range and/or interquartile range), as well as describing any overall pattern and any striking deviations from the overall pattern with reference to the context in which the data were gathered.
Math	6	6.SP.5d	Relating the choice of measures of center and variability to the distribution of the data.
Math	7	7.EE.1	Apply properties of operations as strategies to add, subtract, factor, and expand linear expressions with rational coefficients. Note: factoring is limited to integer coefficients. For example: apply the distributive property to the expression to produce the equivalent expression .
Math	7	7.EE.2	Understand that rewriting an expression in different forms in a problem context can shed light on the problem and how the quantities in it are related. For example, means that “increase by 5%” is the same as “multiply by 1.05.”
Math	7	7.EE.3	Solve multi-step real-life and mathematical problems with rational numbers. Apply properties of operations to calculate with numbers in any form; convert between forms as appropriate; and assess the reasonableness of answers using mental computation and estimation strategies. For example: If a woman making $25 an hour gets a 10% raise, she will make an additional of her salary an hour, or $2.50, for a new salary of $27.50.
Math	7	7.EE.4a	Solve word problems leading to equations of the form , and where p, q, and r are specific rational numbers. Solve equations of these forms fluently (efficiently, accurately, and flexibly). Compare an algebraic solution to an arithmetic solution, identifying the sequence of the operations used in each approach. For example, the perimeter of a rectangle is 54 cm. Its length is 6 cm. What is its width?
Math	7	7.EE.4b	where p, q, and r are specific rational numbers and . Graph the solution set of the inequality and interpret it in the context of the problem. For example: As a salesperson, you are paid $50 per week plus $3 per sale. This week you want your pay to be at least $100. Write an inequality for the number of sales you need to make, and describe the solutions.
Math	7	7.NS.1a	Describe situations in which opposite quantities combine to make 0. Show that a number and its opposite have a sum of 0 (are additive inverses). For example, show zero-pairs with two-color counters.
Math	7	7.NS.1b	Show as the number located a distance from p, in the positive or negative direction depending on whether q is positive or negative.
Math	7	7.NS.1c	Model subtraction as the distance between two rational numbers on the number line where the distance is the absolute value of their difference.
Math	7	7.NS.1d	Apply properties of operations as strategies to add and subtract rational numbers.
Math	7	7.NS.2a	Describe how multiplication is extended from positive rational numbers to all rational numbers by requiring that operations continue to satisfy the properties of operations, particularly the distributive property, leading to products such as and the rules for multiplying signed numbers.
Math	7	7.NS.2b	Explain that integers can be divided, provided that the divisor is not zero, and every quotient of integers (with non-zero divisor) is a rational number. Leading to situations such that if p and q are integers, then .
Math	7	7.NS.2c	Apply properties of operations as strategies to multiply and divide rational numbers.
Math	7	7.NS.2d	Convert a rational number in the form of a fraction to its decimal equivalent using long division; know that the decimal form of a rational number terminates in 0s or eventually repeats.
Math	7	7.NS.3	Solve and interpret real-world and mathematical problems involving the four operations with rational numbers. (Computations with rational numbers extend the rules for manipulating fractions to complex fractions.)
Math	7	7.RP.1	Compute unit rates associated with ratios of fractions, including ratios of lengths, areas and other quantities measured in like or different units. For example, if a person walks mile in each hour, compute the unit rate as the complex fraction miles per hour (interpreting a complex fraction as division of fractions), equivalently 2 miles per hour.
Math	7	7.RP.2a	Determine whether two quantities are in a proportional relationship, e.g. by testing for equivalent ratios in a table or graphing on a coordinate plane and observing whether the graph is a straight line through the origin.
Math	7	7.RP.2b	Analyze a table or graph and recognize that, in a proportional relationship, every pair of numbers has the same unit rate (referred to as the “m”).
Math	7	7.RP.2c	Represent proportional relationships by equations. For example, if total cost t is proportional to the number n of items purchased at a constant price p, the relationship between the total cost and the number of items can be expressed as .
Math	7	7.RP.2d	Explain what a point (x, y) on the graph of a proportional relationship means in terms of the situation, with special attention to the points (0, 0) and (1, r) where r is the unit rate.
Math	7	7.RP.3	Use proportional relationships to solve multistep ratio and percent problems. Examples: simple interest, tax, markups and markdowns, gratuities and commissions, fees, percent increase and decrease, percent error.
Math	7	7.SP.1	Know that generalizations about a population from a sample are valid only if the sample is representative of that population and generate a valid representative sample of a population.
Math	7	7.SP.2	Use data from a random sample to draw inferences about a population with an unknown characteristic of interest. Generate multiple samples (or simulated samples) of the same size to informally gauge the variation in estimates or predictions. For example, estimate the mean word length in a book by randomly sampling words from the book; predict the winner of a school election based on randomly sampled survey data. Gauge how far off the estimate or prediction might be.
Math	7	7.SP.3	Informally assess the degree of visual overlap of two numerical data distributions with similar variabilities, measuring the difference between the centers by expressing it as a multiple of a measure of variability (requires introduction of mean absolute deviation). For example, the mean height of players on the basketball team is 10 cm greater than the mean height of players on the soccer team, about twice the variability (mean absolute deviation) on either team; on a dot plot, the separation between the two distributions of heights is noticeable.
Math	7	7.SP.4	Use measures of center (mean, median and/or mode) and measures of variability (range, interquartile range and/or mean absolute deviation) for numerical data from random samples to draw informal comparative inferences about two populations. For example, decide whether the words in a chapter of a seventh-grade science book are generally longer than the words in a chapter of a fourth-grade science book. (NOTE: Students should not have to calculate mean absolute deviation but use it to interpret data).
Math	7	7.SP.5	Express the probability of a chance event as a number between 0 and 1 that represents the likelihood of the event occurring. (Larger numbers indicate greater likelihood. A probability near 0 indicates an unlikely event, a probability around indicates an event that is neither unlikely nor likely, and a probability near 1 indicates a likely event.)
Math	7	7.SP.6	Collect data from a chance process (probability experiment). Approximate the probability by observing its long-run relative frequency. Recognize that as the number of trials increase, the experimental probability approaches the theoretical probability. Conversely, predict the approximate relative frequency given the probability. For example, when rolling a number cube 600 times, predict that a 3 or 6 would be rolled roughly 200 times, but probably not exactly 200 times.
Math	7	7.SP.7a	Develop a uniform probability model by assigning equal probability to all outcomes, and use the model to determine probabilities of events. For example, if a student is selected at random from a class, find the probability that Jane will be selected and the probability that a girl will be selected.
Math	7	7.SP.7b	Develop a probability model (which may not be uniform) by observing frequencies in data generated from a chance process. For example, find the approximate probability that a spinning penny will land heads up or that a tossed paper cup will land open-end down. Do the outcomes for the spinning penny appear to be equally likely based on the observed frequencies?
Math	7	7.SP.8a	Know that, just as with simple events, the probability of a compound event is the fraction of outcomes in the sample space for which the compound event occurs.
Math	7	7.SP.8b	Represent sample spaces for compound events using methods such as organized lists, tables and tree diagrams. For an event described in everyday language (e.g. “rolling double sixes”), identify the outcomes in the sample space which compose the event.
Math	7	7.SP.8c	Design and use a simulation to generate frequencies for compound events. For example, use random digits as a simulation tool to approximate the answer to the question: If 40% of donors have type A blood, what is the probability that it will take at least 4 donors to find one with type A blood?
